主族群,細分產品,國家,排名,代碼,公司,產業地位
金融,Investment Bankers/Brokers/Service,美,481,RJF,Raymond James Financial Inc. Common Stock,(底層分類，來自Nasdaq官方sector/industry)
傳統產業/原材料,Major Chemicals,美,482,APD,Air Products and Chemicals Inc. Common Stock,(底層分類，來自Nasdaq官方sector/industry)
生技醫藥,Biotechnology: Pharmaceutical Preparations,美,483,TNGX,Tango Therapeutics Inc.,(底層分類，來自Nasdaq官方sector/industry)
科技(綜合),Electrical Products,美,484,CLS,Celestica Inc. Common Stock,(底層分類，來自Nasdaq官方sector/industry)
組裝代工(EMS),電子代工組裝,美,484,CLS,Celestica Inc. Common Stock,電子代工廠
生技醫藥,Medical/Dental Instruments,美,485,DXCM,DexCom Inc. Common Stock,(底層分類，來自Nasdaq官方sector/industry)
工業,Biotechnology: Laboratory Analytical Instruments,美,486,MTD,Mettler-Toledo International Inc. Common Stock,(底層分類，來自Nasdaq官方sector/industry)
消費(非必需),Other Specialty Stores,美,487,DKS,Dick's Sporting Goods Inc Common Stock,(底層分類，來自Nasdaq官方sector/industry)
工業,Broadcasting,美,488,FOXA,Fox Corporation Class A Common Stock,(底層分類，來自Nasdaq官方sector/industry)
傳統消費,Packaged Foods,美,489,GIS,General Mills Inc. Common Stock,(底層分類，來自Nasdaq官方sector/industry)
金融,Life Insurance,美,490,MET,MetLife Inc. Common Stock,(底層分類，來自Nasdaq官方sector/industry)
消費(非必需),Homebuilding,美,491,DHI,D.R. Horton Inc. Common Stock,(底層分類，來自Nasdaq官方sector/industry)
工業,Plastic Products,美,492,NWL,Newell Brands Inc. Common Stock,(底層分類，來自Nasdaq官方sector/industry)
消費(非必需),RETAIL: Building Materials,美,493,QXO,QXO Inc. Common Stock,(底層分類，來自Nasdaq官方sector/industry)
科技(綜合),Retail: Computer Software & Peripheral Equipment,美,494,SNX,TD SYNNEX Corporation Common Stock,(底層分類，來自Nasdaq官方sector/industry)
消費(非必需),Food Distributors,美,495,SYY,Sysco Corporation Common Stock,(底層分類，來自Nasdaq官方sector/industry)
公用事業,Water Supply,美,496,AWK,American Water Works Company Inc. Common Stock,(底層分類，來自Nasdaq官方sector/industry)
科技(綜合),Computer Software: Prepackaged Software,美,497,STRC,Strategy Inc Variable Rate Series A Perpetual Stretch Preferred Stock,(底層分類，來自Nasdaq官方sector/industry)
傳統消費,Food Chains,美,498,KR,Kroger Company (The) Common Stock,(底層分類，來自Nasdaq官方sector/industry)
消費(非必需),Food Distributors,美,499,DPZ,Domino's Pizza Inc Common Stock,(底層分類，來自Nasdaq官方sector/industry)
生技醫藥,Industrial Specialties,美,500,ESTA,Establishment Labs Holdings Inc. Common Shares,(底層分類，來自Nasdaq官方sector/industry)
工業,Metal Fabrications,美,501,SMR,NuScale Power Corporation Class A Common Stock,(底層分類，來自Nasdaq官方sector/industry)
核能/SMR,小型模組化反應爐,美,501,SMR,NuScale Power Corporation Class A Common Stock,SMR新創
不動產,Real Estate Investment Trusts,美,502,NTST,NetSTREIT Corp. Common Stock,(底層分類，來自Nasdaq官方sector/industry)
金融,Investment Managers,美,503,JHG,Janus Henderson Group plc Ordinary Shares,(底層分類，來自Nasdaq官方sector/industry)
公用事業,Electric Utilities: Central,美,504,ETR,Entergy Corporation Common Stock,(底層分類，來自Nasdaq官方sector/industry)
生技醫藥,Biotechnology: Biological Products (No Diagnostic Substances),美,505,KYMR,Kymera Therapeutics Inc. Common Stock,(底層分類，來自Nasdaq官方sector/industry)
生技醫藥,Medical Specialities,美,506,OSCR,Oscar Health Inc. Class A Common Stock,(底層分類，來自Nasdaq官方sector/industry)
金融,Investment Managers,美,507,ARES,Ares Management Corporation Class A Common Stock,(底層分類，來自Nasdaq官方sector/industry)
科技(綜合),EDP Services,美,508,INFQ,Infleqtion Inc. Common Stock,(底層分類，來自Nasdaq官方sector/industry)
量子計算,量子感測,美,508,INFQ,Infleqtion Inc. Common Stock,量子感測技術廠
工業,Industrial Specialties,美,509,MTRN,Materion Corporation,(底層分類，來自Nasdaq官方sector/industry)
傳統消費,Beverages (Production/Distribution),美,510,BUD,Anheuser-Busch Inbev SA Sponsored ADR (Belgium),(底層分類，來自Nasdaq官方sector/industry)
金融,Investment Bankers/Brokers/Service,美,511,GLXY,Galaxy Digital Inc. Class A Common Stock,(底層分類，來自Nasdaq官方sector/industry)
消費(非必需),Specialty Chemicals,美,512,ASH,Ashland Inc. Common Stock,(底層分類，來自Nasdaq官方sector/industry)
消費(非必需),Hotels/Resorts,美,513,PK,Park Hotels & Resorts Inc. Common Stock ,(底層分類，來自Nasdaq官方sector/industry)
能源,Oil & Gas Production,美,514,PR,Permian Resources Corporation Class A Common Stock,(底層分類，來自Nasdaq官方sector/industry)
科技(綜合),Semiconductors,美,515,SLAB,Silicon Laboratories Inc. Common Stock,(底層分類，來自Nasdaq官方sector/industry)
金融,Real Estate,美,516,CBRE,CBRE Group Inc Common Stock Class A,(底層分類，來自Nasdaq官方sector/industry)
公用事業,Environmental Services,美,517,RSG,Republic Services Inc. Common Stock,(底層分類，來自Nasdaq官方sector/industry)
不動產,Real Estate Investment Trusts,美,518,LAMR,Lamar Advertising Company Class A Common Stock,(底層分類，來自Nasdaq官方sector/industry)
消費(非必需),Other Specialty Stores,美,519,ULTA,Ulta Beauty Inc. Common Stock,(底層分類，來自Nasdaq官方sector/industry)
金融,Finance: Consumer Services,美,520,CHYM,Chime Financial Inc. Class A Common Stock,(底層分類，來自Nasdaq官方sector/industry)
生技醫藥,Medical/Dental Instruments,美,521,HTFL,Heartflow Inc. Common Stock,(底層分類，來自Nasdaq官方sector/industry)
金融,Major Banks,美,522,TFC,Truist Financial Corporation Common Stock,(底層分類，來自Nasdaq官方sector/industry)
傳統消費,Beverages (Production/Distribution),美,523,STZ,Constellation Brands Inc. Common Stock,(底層分類，來自Nasdaq官方sector/industry)
消費(非必需),Other Specialty Stores,美,524,RH,RH Common Stock,(底層分類，來自Nasdaq官方sector/industry)
生技醫藥,Medical/Dental Instruments,美,525,WST,West Pharmaceutical Services Inc. Common Stock,(底層分類，來自Nasdaq官方sector/industry)
生技醫藥,Medical/Dental Instruments,美,526,PODD,Insulet Corporation Common Stock,(底層分類，來自Nasdaq官方sector/industry)
消費(非必需),Business Services,美,527,FICO,Fair Isaac Corporation Common Stock,(底層分類，來自Nasdaq官方sector/industry)
消費(非必需),Homebuilding,美,528,PHM,PulteGroup Inc. Common Stock,(底層分類，來自Nasdaq官方sector/industry)
生技醫藥,Medical/Dental Instruments,美,529,MDLN,Medline Inc. Class A Common Stock,(底層分類，來自Nasdaq官方sector/industry)
科技(綜合),Semiconductors,美,530,FSLR,First Solar Inc. Common Stock,(底層分類，來自Nasdaq官方sector/industry)
綠能/太陽能,太陽能板製造,美,530,FSLR,First Solar Inc. Common Stock,美國最大太陽能板廠
工業,Railroads,美,531,NSC,Norfolk Southern Corporation Common Stock,(底層分類，來自Nasdaq官方sector/industry)
科技(綜合),Semiconductors,美,532,KLIC,Kulicke and Soffa Industries Inc. Common Stock,(底層分類，來自Nasdaq官方sector/industry)
科技(綜合),Computer Software: Prepackaged Software,美,533,FRSH,Freshworks Inc. Class A Common Stock,(底層分類，來自Nasdaq官方sector/industry)
能源,Oil & Gas Production,美,534,EXE,Expand Energy Corporation Common Stock,(底層分類，來自Nasdaq官方sector/industry)
生技醫藥,Biotechnology: Pharmaceutical Preparations,美,535,ALNY,Alnylam Pharmaceuticals Inc. Common Stock,(底層分類，來自Nasdaq官方sector/industry)
傳統產業/原材料,Metal Mining,美,536,VALE,VALE S.A.  American Depositary Shares Each Representing one common share,(底層分類，來自Nasdaq官方sector/industry)
消費(非必需),Hotels/Resorts,美,537,PENN,PENN Entertainment Inc. Common Stock,(底層分類，來自Nasdaq官方sector/industry)
工業,Mining & Quarrying of Nonmetallic Minerals (No Fuels),美,538,MLM,Martin Marietta Materials Inc. Common Stock,(底層分類，來自Nasdaq官方sector/industry)
生技醫藥,Biotechnology: Commercial Physical & Biological Resarch,美,539,INCY,Incyte Corp. Common Stock,(底層分類，來自Nasdaq官方sector/industry)
傳統產業/原材料,Precious Metals,美,540,AEM,Agnico Eagle Mines Limited Common Stock,(底層分類，來自Nasdaq官方sector/industry)
生技醫藥,Medical Specialities,美,541,ACHC,Acadia Healthcare Company Inc. Common Stock,(底層分類，來自Nasdaq官方sector/industry)
消費(非必需),Services-Misc. Amusement & Recreation,美,542,DKNG,DraftKings Inc. Class A Common Stock,(底層分類，來自Nasdaq官方sector/industry)
生技醫藥,Biotechnology: In Vitro & In Vivo Diagnostic Substances,美,543,ORKA,Oruka Therapeutics Inc. Common Stock,(底層分類，來自Nasdaq官方sector/industry)
傳統產業/原材料,Precious Metals,美,544,B,Barrick Mining Corporation Common Shares,(底層分類，來自Nasdaq官方sector/industry)
工業,Metal Fabrications,美,545,CXT,Crane NXT Co. Common Stock,(底層分類，來自Nasdaq官方sector/industry)
生技醫藥,Biotechnology: Biological Products (No Diagnostic Substances),美,546,TWST,Twist Bioscience Corporation Common Stock,(底層分類，來自Nasdaq官方sector/industry)
工業,Biotechnology: Laboratory Analytical Instruments,美,547,A,Agilent Technologies Inc. Common Stock,(底層分類，來自Nasdaq官方sector/industry)
金融,Accident &Health Insurance,美,548,AFL,AFLAC Incorporated Common Stock,(底層分類，來自Nasdaq官方sector/industry)
消費(非必需),Metal Fabrications,美,549,RRX,Regal Rexnord Corporation Common Stock,(底層分類，來自Nasdaq官方sector/industry)
生技醫藥,Biotechnology: Pharmaceutical Preparations,美,550,ROIV,Roivant Sciences Ltd. Common Shares,(底層分類，來自Nasdaq官方sector/industry)
金融,Investment Bankers/Brokers/Service,美,551,TROW,T. Rowe Price Group Inc. Common Stock,(底層分類，來自Nasdaq官方sector/industry)
消費(非必需),Food Distributors,美,552,USFD,US Foods Holding Corp. Common Stock,(底層分類，來自Nasdaq官方sector/industry)
金融,Investment Bankers/Brokers/Service,美,553,CBOE,Cboe Global Markets Inc. Common Stock,(底層分類，來自Nasdaq官方sector/industry)
生技醫藥,Medical/Dental Instruments,美,554,RMD,ResMed Inc. Common Stock,(底層分類，來自Nasdaq官方sector/industry)
科技(綜合),Semiconductors,美,555,NVTS,Navitas Semiconductor Corporation Common Stock,(底層分類，來自Nasdaq官方sector/industry)
功率半導體,GaN功率元件,美,555,NVTS,Navitas Semiconductor Corporation Common Stock,GaN功率元件廠
能源,Oilfield Services/Equipment,美,556,HAL,Halliburton Company Common Stock,(底層分類，來自Nasdaq官方sector/industry)
生技醫藥,Biotechnology: Pharmaceutical Preparations,美,557,MIRM,Mirum Pharmaceuticals Inc. Common Stock,(底層分類，來自Nasdaq官方sector/industry)
生技醫藥,Biotechnology: Pharmaceutical Preparations,美,558,ALKS,Alkermes plc Ordinary Shares,(底層分類，來自Nasdaq官方sector/industry)
工業,Biotechnology: Laboratory Analytical Instruments,美,559,RVTY,Revvity Inc. Common Stock,(底層分類，來自Nasdaq官方sector/industry)
消費(非必需),Home Furnishings,美,560,WSM,Williams-Sonoma Inc. Common Stock (DE),(底層分類，來自Nasdaq官方sector/industry)
生技醫藥,Biotechnology: Biological Products (No Diagnostic Substances),美,561,SRRK,Scholar Rock Holding Corporation Common Stock,(底層分類，來自Nasdaq官方sector/industry)
工業,Major Chemicals,美,562,DD,DuPont de Nemours Inc. Common Stock,(底層分類，來自Nasdaq官方sector/industry)
科技(綜合),Computer Software: Prepackaged Software,美,563,TWLO,Twilio Inc. Class A Common Stock,(底層分類，來自Nasdaq官方sector/industry)
金融,Major Banks,美,564,HBAN,Huntington Bancshares Incorporated Common Stock,(底層分類，來自Nasdaq官方sector/industry)
消費(非必需),Package Goods/Cosmetics,美,565,EL,Estee Lauder Companies Inc. (The) Common Stock,(底層分類，來自Nasdaq官方sector/industry)
工業,Steel/Iron Ore,美,566,STLD,Steel Dynamics Inc.,(底層分類，來自Nasdaq官方sector/industry)
工業,Water Sewer Pipeline Comm & Power Line Construction,美,567,MYRG,MYR Group Inc. Common Stock,(底層分類，來自Nasdaq官方sector/industry)
科技(綜合),Electrical Products,美,568,HUBB,Hubbell Inc Common Stock,(底層分類，來自Nasdaq官方sector/industry)
公用事業,Power Generation,美,569,PCG,Pacific Gas & Electric Co. Common Stock,(底層分類，來自Nasdaq官方sector/industry)
科技(綜合),EDP Services,美,570,COMP,Compass Inc. Class A Common Stock,(底層分類，來自Nasdaq官方sector/industry)
消費(非必需),Department/Specialty Retail Stores,美,571,DG,Dollar General Corporation Common Stock,(底層分類，來自Nasdaq官方sector/industry)
科技(綜合),Electronic Components,美,572,NVMI,Nova Ltd. Ordinary Shares,(底層分類，來自Nasdaq官方sector/industry)
半導體設備,檢測設備,美,572,NVMI,Nova Ltd. Ordinary Shares,半導體量測設備廠
金融,Investment Bankers/Brokers/Service,美,573,MIAX,Miami International Holdings Inc. Common Stock,(底層分類，來自Nasdaq官方sector/industry)
生技醫藥,Biotechnology: Pharmaceutical Preparations,美,574,KNSA,Kiniksa Pharmaceuticals International plc Class A Ordinary Shares,(底層分類，來自Nasdaq官方sector/industry)
消費(非必需),Containers/Packaging,美,575,SW,Smurfit WestRock plc Ordinary Shares,(底層分類，來自Nasdaq官方sector/industry)
不動產,Real Estate Investment Trusts,美,576,PSA,Public Storage Common Stock,(底層分類，來自Nasdaq官方sector/industry)
科技(綜合),Electrical Products,美,577,VSH,Vishay Intertechnology Inc. Common Stock,(底層分類，來自Nasdaq官方sector/industry)
被動元件,綜合被動元件,美,577,VSH,Vishay Intertechnology Inc. Common Stock,電阻/電容/電感/二極體綜合大廠
能源,Integrated oil Companies,美,578,BP,BP p.l.c. Common Stock,(底層分類，來自Nasdaq官方sector/industry)
科技(綜合),Computer Software: Prepackaged Software,美,579,GWRE,Guidewire Software Inc. Common Stock,(底層分類，來自Nasdaq官方sector/industry)
公用事業,Natural Gas Distribution,美,580,SRE,DBA Sempra Common Stock,(底層分類，來自Nasdaq官方sector/industry)
生技醫藥,Biotechnology: Pharmaceutical Preparations,美,581,RPRX,Royalty Pharma plc Class A Ordinary Shares ,(底層分類，來自Nasdaq官方sector/industry)
科技(綜合),Computer Manufacturing,美,582,HPQ,HP Inc. Common Stock,(底層分類，來自Nasdaq官方sector/industry)
消費(非必需),Military/Government/Technical,美,583,VSEC,VSE Corporation Common Stock,(底層分類，來自Nasdaq官方sector/industry)
工業,Industrial Machinery/Components,美,584,DOV,Dover Corporation Common Stock,(底層分類，來自Nasdaq官方sector/industry)
科技(綜合),Electronic Components,美,585,P,Everpure Inc. Class A common stock,(底層分類，來自Nasdaq官方sector/industry)
生技醫藥,Biotechnology: Pharmaceutical Preparations,美,586,NKTR,Nektar Therapeutics  Common Stock,(底層分類，來自Nasdaq官方sector/industry)
金融,Finance: Consumer Services,美,587,SYF,Synchrony Financial Common Stock,(底層分類，來自Nasdaq官方sector/industry)
生技醫藥,Biotechnology: Pharmaceutical Preparations,美,588,SYRE,Spyre Therapeutics Inc. Common Stock,(底層分類，來自Nasdaq官方sector/industry)
消費(非必需),Catalog/Specialty Distribution,美,589,W,Wayfair Inc. Class A Common Stock,(底層分類，來自Nasdaq官方sector/industry)
消費(非必需),Marine Transportation,美,590,VIK,Viking Holdings Ltd Ordinary Shares,(底層分類，來自Nasdaq官方sector/industry)
生技醫藥,Medical Specialities,美,591,ILMN,Illumina Inc. Common Stock,(底層分類，來自Nasdaq官方sector/industry)
消費(非必需),Hotels/Resorts,美,592,LTH,Life Time Group Holdings Inc. Common Stock,(底層分類，來自Nasdaq官方sector/industry)
科技(綜合),Semiconductors,美,593,ENPH,Enphase Energy Inc. Common Stock,(底層分類，來自Nasdaq官方sector/industry)
綠能/太陽能,太陽能微逆變器,美,593,ENPH,Enphase Energy Inc. Common Stock,太陽能逆變器系統廠
生技醫藥,Biotechnology: Pharmaceutical Preparations,美,594,TGTX,TG Therapeutics Inc. Common Stock,(底層分類，來自Nasdaq官方sector/industry)
生技醫藥,Medical Specialities,美,595,CNC,Centene Corporation Common Stock,(底層分類，來自Nasdaq官方sector/industry)
消費(非必需),Restaurants,美,596,BROS,Dutch Bros Inc. Class A Common Stock,(底層分類，來自Nasdaq官方sector/industry)
工業,Trucking Freight/Courier Services,美,597,JBHT,J.B. Hunt Transport Services Inc. Common Stock,(底層分類，來自Nasdaq官方sector/industry)
不動產,Real Estate Investment Trusts,美,598,VICI,VICI Properties Inc. Common Stock,(底層分類，來自Nasdaq官方sector/industry)
科技(綜合),Computer Software: Prepackaged Software,美,599,DOCU,DocuSign Inc. Common Stock,(底層分類，來自Nasdaq官方sector/industry)
其他,Miscellaneous,美,600,FERG,Ferguson Enterprises Inc. Common Stock,(底層分類，來自Nasdaq官方sector/industry)
生技醫藥,Biotechnology: Pharmaceutical Preparations,美,601,LGND,Ligand Pharmaceuticals Incorporated Common Stock,(底層分類，來自Nasdaq官方sector/industry)
生技醫藥,Biotechnology: Biological Products (No Diagnostic Substances),美,602,EXEL,Exelixis Inc. Common Stock,(底層分類，來自Nasdaq官方sector/industry)
電信,Telecommunications Equipment,美,603,LUMN,Lumen Technologies Inc. Common Stock,(底層分類，來自Nasdaq官方sector/industry)
工業,Industrial Machinery/Components,美,604,GRMN,Garmin Ltd. Common Stock (Switzerland),(底層分類，來自Nasdaq官方sector/industry)
生技醫藥,Biotechnology: Pharmaceutical Preparations,美,605,COGT,Cogent Biosciences Inc. Common Stock,(底層分類，來自Nasdaq官方sector/industry)
消費(非必需),Catalog/Specialty Distribution,美,606,CPNG,Coupang Inc. Class A Common Stock,(底層分類，來自Nasdaq官方sector/industry)
金融,Investment Managers,美,607,ILLR,Triller Group Inc. Common Stock,(底層分類，來自Nasdaq官方sector/industry)
科技(綜合),Computer Software: Prepackaged Software,美,608,NTNX,Nutanix Inc. Class A Common Stock,(底層分類，來自Nasdaq官方sector/industry)
工業,Military/Government/Technical,美,609,RDW,Redwire Corporation Common Stock,(底層分類，來自Nasdaq官方sector/industry)
太空產業,太空基礎設施,美,609,RDW,Redwire Corporation Common Stock,太空基礎設施廠
金融,Major Banks,美,610,MTB,M&T Bank Corporation Common Stock,(底層分類，來自Nasdaq官方sector/industry)
工業,Aluminum,美,611,AA,Alcoa Corporation Common Stock ,(底層分類，來自Nasdaq官方sector/industry)
傳統消費,Packaged Foods,美,612,MKC,McCormick & Company Incorporated Common Stock,(底層分類，來自Nasdaq官方sector/industry)
科技(綜合),Semiconductors,美,613,UCTT,Ultra Clean Holdings Inc. Common Stock,(底層分類，來自Nasdaq官方sector/industry)
生技醫藥,Biotechnology: Pharmaceutical Preparations,美,614,NUVL,Nuvalent Inc. Class A Common Stock,(底層分類，來自Nasdaq官方sector/industry)
消費(非必需),Services-Misc. Amusement & Recreation,美,615,TKO,TKO Group Holdings Inc. Class A Common Stock,(底層分類，來自Nasdaq官方sector/industry)
金融,Major Banks,美,616,UMBF,UMB Financial Corporation Common Stock,(底層分類，來自Nasdaq官方sector/industry)
不動產,Real Estate Investment Trusts,美,617,AGNC,AGNC Investment Corp. Common Stock,(底層分類，來自Nasdaq官方sector/industry)
科技(綜合),Retail: Computer Software & Peripheral Equipment,美,618,CDW,CDW Corporation Common Stock,(底層分類，來自Nasdaq官方sector/industry)
工業,Industrial Machinery/Components,美,619,TDY,Teledyne Technologies Incorporated Common Stock,(底層分類，來自Nasdaq官方sector/industry)
傳統消費,Specialty Foods,美,620,HSY,The Hershey Company Common Stock,(底層分類，來自Nasdaq官方sector/industry)
科技(綜合),Computer Software: Prepackaged Software,美,621,NAVN,Navan Inc. Class A Common Stock,(底層分類，來自Nasdaq官方sector/industry)
消費(非必需),Motor Vehicles,美,622,HOG,Harley-Davidson Inc. Common Stock,(底層分類，來自Nasdaq官方sector/industry)
生技醫藥,Misc Health and Biotechnology Services,美,623,DVA,DaVita Inc. Common Stock,(底層分類，來自Nasdaq官方sector/industry)
不動產,Real Estate Investment Trusts,美,624,CTRE,CareTrust REIT Inc. Common Stock,(底層分類，來自Nasdaq官方sector/industry)
科技(綜合),Computer Software: Programming Data Processing,美,625,FDS,FactSet Research Systems Inc. Common Stock,(底層分類，來自Nasdaq官方sector/industry)
生技醫藥,Biotechnology: Biological Products (No Diagnostic Substances),美,626,IBRX,ImmunityBio Inc. Common Stock,(底層分類，來自Nasdaq官方sector/industry)
科技(綜合),Industrial Machinery/Components,美,627,ACMR,ACM Research Inc. Class A Common Stock,(底層分類，來自Nasdaq官方sector/industry)
半導體設備,蝕刻/清洗設備,美,627,ACMR,ACM Research Inc. Class A Common Stock,半導體設備廠
科技(綜合),Industrial Machinery/Components,美,628,VECO,Veeco Instruments Inc. Common Stock,(底層分類，來自Nasdaq官方sector/industry)
工業,Major Chemicals,美,629,DOW,Dow Inc. Common Stock ,(底層分類，來自Nasdaq官方sector/industry)
工業,Construction/Ag Equipment/Trucks,美,630,TEX,Terex Corporation Common Stock,(底層分類，來自Nasdaq官方sector/industry)
電信,Telecommunications Equipment,美,631,ESE,ESCO Technologies Inc. Common Stock,(底層分類，來自Nasdaq官方sector/industry)
生技醫藥,Biotechnology: Biological Products (No Diagnostic Substances),美,632,ARGX,argenx SE American Depositary Shares,(底層分類，來自Nasdaq官方sector/industry)
公用事業,Oil/Gas Transmission,美,633,ATO,Atmos Energy Corporation Common Stock,(底層分類，來自Nasdaq官方sector/industry)
生技醫藥,Medical/Dental Instruments,美,634,XRAY,DENTSPLY SIRONA Inc. Common Stock,(底層分類，來自Nasdaq官方sector/industry)
消費(非必需),Department/Specialty Retail Stores,美,635,BURL,Burlington Stores Inc. Common Stock,(底層分類，來自Nasdaq官方sector/industry)
消費(非必需),Professional Services,美,636,BAH,Booz Allen Hamilton Holding Corporation Common Stock,(底層分類，來自Nasdaq官方sector/industry)
傳統消費,Packaged Foods,美,637,KHC,The Kraft Heinz Company Common Stock,(底層分類，來自Nasdaq官方sector/industry)
工業,Metal Fabrications,美,638,RBC,RBC Bearings Incorporated Common Stock,(底層分類，來自Nasdaq官方sector/industry)
科技(綜合),Semiconductors,美,639,LASR,nLIGHT Inc. Common Stock,(底層分類，來自Nasdaq官方sector/industry)
能源,Oil & Gas Production,美,640,SHEL,Shell PLC American Depositary Shares (each representing two (2) Ordinary Shares) ,(底層分類，來自Nasdaq官方sector/industry)
工業,Industrial Machinery/Components,美,641,AME,AMETEK Inc.,(底層分類，來自Nasdaq官方sector/industry)
工業,Precious Metals,美,642,SSRM,SSR Mining Inc. Common Stock,(底層分類，來自Nasdaq官方sector/industry)
消費(非必需),Restaurants,美,643,QSR,Restaurant Brands International Inc. Common Shares,(底層分類，來自Nasdaq官方sector/industry)
工業,Major Chemicals,美,644,ESI,Element Solutions Inc. Common Stock,(底層分類，來自Nasdaq官方sector/industry)
消費(非必需),Restaurants,美,645,EAT,Brinker International Inc. Common Stock,(底層分類，來自Nasdaq官方sector/industry)
生技醫藥,Biotechnology: Biological Products (No Diagnostic Substances),美,646,CGON,CG Oncology Inc. Common stock,(底層分類，來自Nasdaq官方sector/industry)
傳統產業/原材料,Metal Mining,美,647,USAR,USA Rare Earth Inc. Class A Common Stock,(底層分類，來自Nasdaq官方sector/industry)
科技(綜合),Semiconductors,美,648,WOLF,Wolfspeed Inc. Common Stock New,(底層分類，來自Nasdaq官方sector/industry)
功率半導體,SiC功率元件,美,648,WOLF,Wolfspeed Inc. Common Stock New,SiC功率元件專業廠
電信,Cable & Other Pay Television Services,美,649,CHTR,Charter Communications Inc. Class A Common Stock New,(底層分類，來自Nasdaq官方sector/industry)
工業,Steel/Iron Ore,美,650,CMC,Commercial Metals Company Common Stock,(底層分類，來自Nasdaq官方sector/industry)
金融,Finance: Consumer Services,美,651,DAVE,Dave Inc. Class A Common Stock,(底層分類，來自Nasdaq官方sector/industry)
金融,Finance: Consumer Services,美,652,EFX,Equifax Inc. Common Stock,(底層分類，來自Nasdaq官方sector/industry)
科技(綜合),Computer Software: Prepackaged Software,美,653,SAP,SAP  SE ADS,(底層分類，來自Nasdaq官方sector/industry)
消費(非必需),Food Distributors,美,654,PFGC,Performance Food Group Company Common Stock,(底層分類，來自Nasdaq官方sector/industry)
工業,Railroads,美,655,CP,Canadian Pacific Kansas City Limited Common Shares,(底層分類，來自Nasdaq官方sector/industry)
工業,Military/Government/Technical,美,656,GVA,Granite Construction Incorporated Common Stock,(底層分類，來自Nasdaq官方sector/industry)
