code,name,sector,industry,price,volume,amount_usd,rank
ZBH,Zimmer Biomet Holdings Inc. Common Stock,Health Care,Industrial Specialties,91.34,1543251.0,140960546.34,666
ZETA,Zeta Global Holdings Corp. Class A Common Stock,Technology,Computer Software: Prepackaged Software,21.49,6534786.0,140432551.14,667
FBRX,Forte Biosciences Inc. Common Stock,Health Care,Biotechnology: Pharmaceutical Preparations,43.92,3186345.0,139944272.4,668
DY,Dycom Industries Inc. Common Stock,Industrials,Water Sewer Pipeline Comm & Power Line Construction,425.72,328669.0,139920966.68,669
NI,NiSource Inc Common Stock,Utilities,Power Generation,46.9,2983166.0,139910485.4,670
PTGX,Protagonist Therapeutics Inc. Common Stock,Health Care,Biotechnology: Pharmaceutical Preparations,131.42,1060930.0,139427420.6,671
SCCO,Southern Copper Corporation Common Stock,Basic Materials,Metal Mining,175.83,791271.0,139129179.93,672
DOC,Healthpeak Properties Inc. Common Stock,Real Estate,Real Estate Investment Trusts,21.65,6407816.0,138729216.39999998,673
DKS,Dick's Sporting Goods Inc Common Stock,Consumer Discretionary,Other Specialty Stores,217.98,635960.0,138626560.79999998,674
BROS,Dutch Bros Inc. Class A Common Stock,Consumer Discretionary,Restaurants,67.56,2051062.0,138569748.72,675
MTD,Mettler-Toledo International Inc. Common Stock,Industrials,Biotechnology: Laboratory Analytical Instruments,1296.17,106818.0,138454287.06,676
CACI,CACI International Inc. Class A Common Stock,Technology,EDP Services,486.45,284547.0,138417888.15,677
QS,QuantumScape Corporation Class A Common Stock,Miscellaneous,Industrial Machinery/Components,6.58,20978682.0,138039727.56,678
LYFT,Lyft Inc. Class A Common Stock,Consumer Discretionary,Business Services,15.61,8819027.0,137665011.47,679
TARS,Tarsus Pharmaceuticals Inc. Common Stock,Health Care,Biotechnology: Biological Products (No Diagnostic Substances),58.14,2367209.0,137629531.26,680
TRI,Thomson Reuters Corporation Common Shares,Consumer Discretionary,Publishing,89.65,1532380.0,137377867.0,681
ZBAO,Zhibao Technology Inc. Class A Ordinary Shares,Finance,Specialty Insurers,0.4238,323562617.0,137125837.0846,682
PKG,Packaging Corporation of America Common Stock,Consumer Discretionary,Containers/Packaging,228.77,598111.0,136829853.47,683
VIK,Viking Holdings Ltd Ordinary Shares,Consumer Discretionary,Marine Transportation,99.14,1379929.0,136806161.06,684
BN,Brookfield Corporation Class A Limited Voting Shares,Real Estate,Building operators,43.73,3127422.0,136762164.06,685
ESS,Essex Property Trust Inc. Common Stock,Real Estate,Real Estate Investment Trusts,293.55,464360.0,136312878.0,686
CCEP,Coca-Cola Europacific Partners plc Ordinary Shares,Consumer Staples,Beverages (Production/Distribution),105.84,1285790.0,136088013.6,687
BNS,Bank Nova Scotia Halifax Pfd 3 Ordinary Shares,Finance,Major Banks,87.59,1552958.0,136023591.22,688
ACI,Albertsons Companies Inc. Class A Common Stock,Consumer Staples,Food Chains,14.76,9214130.0,136000558.8,689
CLF,Cleveland-Cliffs Inc. Common Stock,Basic Materials,Metal Mining,9.4,14390881.0,135274281.4,690
AGNC,AGNC Investment Corp. Common Stock,Real Estate,Real Estate Investment Trusts,11.13,12143692.0,135159291.96,691
EQPT,EquipmentShare.com Inc Class A Common Stock,Consumer Discretionary,Diversified Commercial Services,18.65,7210369.0,134473381.85,692
LEVI,Levi Strauss & Co Class A Common Stock,Consumer Discretionary,Apparel,24.31,5508866.0,133920532.46,693
FLNC,Fluence Energy Inc. Class A Common Stock,Miscellaneous,Industrial Machinery/Components,16.16,8285093.0,133887102.88,694
NTES,NetEase Inc. American Depositary Shares,Technology,Computer Software: Prepackaged Software,128.03,1045664.0,133876361.92,695
GFL,GFL Environmental Inc. Subordinate voting shares no par value,Utilities,Environmental Services,39.75,3351577.0,133225185.75,696
KRYS,Krystal Biotech Inc. Common Stock,Health Care,Biotechnology: Biological Products (No Diagnostic Substances),365.81,363770.0,133070703.7,697
RNR,RenaissanceRe Holdings Ltd. Common Stock,Finance,Property-Casualty Insurers,314.99,421910.0,132897430.9,698
TCOM,Trip.com Group Limited American Depositary Shares,Consumer Discretionary,Business Services,42.8,3104800.0,132885439.99999999,699
AEE,Ameren Corporation Common Stock,Utilities,Power Generation,112.94,1173943.0,132585122.42,700
